{
  "contractVersion": "1.0",
  "skillVersion": "0.2.0",
  "templateVersion": "0.2.0",
  "uiSnapshot": {
    "distribution": "skill-template",
    "vocabularyDigest": "b1e9cd04c195828d578d42587e854c5b4da695dff98bd2d111bd68e321879556"
  },
  "projectDigest": "8b69adaa481889539bb6eb675fd4a6718285592fd4a58de417a06ccdb4bffb53",
  "inventory": {
    "sections": [
      "home",
      "vision",
      "starting",
      "workflow",
      "planning",
      "development",
      "spec"
    ],
    "catalogs": [
      "prds",
      "stories",
      "plans",
      "adr"
    ],
    "vocabulary": [
      "Card",
      "Cards",
      "File",
      "Files",
      "Folder",
      "DocKind",
      "DocStatus",
      "AdrStatus",
      "Decision",
      "SpecVersion",
      "Canvas",
      "CanvasLegend",
      "DocsInlineToc",
      "DocsSidebarFolder",
      "indexOnlyPageTree",
      "createCatalogNavigation"
    ]
  },
  "files": {
    "docs/content/docs/meta.json": {
      "ownership": "omd-managed",
      "digest": "4bf233cf6f6a7c8da2402168a24231884b4bf20dacf1fe5513e279f1fda7481f"
    },
    "AGENTS.md": {
      "ownership": "omd-managed",
      "digest": "1d274c386f5a86ab4cd0fc2d241a26b3391a2cbce4a51301be9a33ca3535e02c"
    },
    "CLAUDE.md": {
      "ownership": "omd-managed",
      "digest": "b8a4d26aeeda1fdbd5262688652b02776cd50965b8fcbf0e918fca1419bac762"
    }
  }
}
